tune_result/sparse4d_miopen_tuning/gfx94250.HIP.3_3_0_a85ca8a54-dirty.ufdb.txt
3-256-704-7x7-64-128-352-36-3x3-2x2-1x1-0-NCHW-FP16-F=ConvBinWinogradRxSf3x2:2.68583,0,miopenConvolutionFwdAlgoWinograd;ConvAsmImplicitGemmGTCDynamicFwdXdlopsNHWC:1.568,661801472,miopenConvolutionFwdAlgoImplicitGEMM;GemmFwdRest:4.21472,13246464,miopenConvolutionFwdAlgoGEMM;ConvDirectNaiveConvFwd:44.3483,0,miopenConvolutionFwdAlgoDirect
64-64-176-1x1-64-64-176-36-0x0-1x1-1x1-0-NCHW-FP16-F=ConvBinWinogradRxSf3x2:0.45295,0,miopenConvolutionFwdAlgoWinograd;ConvAsmImplicitGemmGTCDynamicFwdXdlopsNHWC:0.215091,207618048,miopenConvolutionFwdAlgoImplicitGEMM;GemmFwd1x1_0_1:0.230683,0,miopenConvolutionFwdAlgoGEMM;ConvDirectNaiveConvFwd:8.49328,0,miopenConvolutionFwdAlgoDirect
64-64-176-3x3-64-64-176-36-1x1-1x1-1x1-0-NCHW-FP16-F=ConvBinWinogradRxSf2x3g1:0.843805,0,miopenConvolutionFwdAlgoWinograd;ConvBinWinogradRxSf3x2:1.35835,0,miopenConvolutionFwdAlgoWinograd;ConvAsmImplicitGemmGTCDynamicFwdXdlopsNHWC:0.483102,207691776,miopenConvolutionFwdAlgoImplicitGEMM;GemmFwdRest:2.28606,12976128,miopenConvolutionFwdAlgoGEMM;ConvDirectNaiveConvFwd:37.7429,0,miopenConvolutionFwdAlgoDirect
64-64-176-1x1-256-64-176-36-0x0-1x1-1x1-0-NCHW-FP16-F=ConvBinWinogradRxSf3x2:1.73687,0,miopenConvolutionFwdAlgoWinograd;ConvAsmImplicitGemmGTCDynamicFwdXdlopsNHWC:0.731816,674758656,miopenConvolutionFwdAlgoImplicitGEMM;GemmFwd1x1_0_1:0.953811,0,miopenConvolutionFwdAlgoGEMM;ConvDirectNaiveConvFwd:31.0007,0,miopenConvolutionFwdAlgoDirect
256-64-176-1x1-64-64-176-36-0x0-1x1-1x1-0-NCHW-FP16-F=ConvBinWinogradRxSf3x2:1.32744,0,miopenConvolutionFwdAlgoWinograd;ConvAsmImplicitGemmGTCDynamicFwdXdlopsNHWC:0.84275,363331584,miopenConvolutionFwdAlgoImplicitGEMM;GemmFwd1x1_0_1:0.415183,0,miopenConvolutionFwdAlgoGEMM;ConvDirectNaiveConvFwd:33.7876,0,miopenConvolutionFwdAlgoDirect
256-64-176-1x1-128-64-176-36-0x0-1x1-1x1-0-NCHW-FP16-F=ConvBinWinogradRxSf3x2:2.63654,0,miopenConvolutionFwdAlgoWinograd;ConvAsmImplicitGemmGTCDynamicFwdXdlopsNHWC:1.01681,519045120,miopenConvolutionFwdAlgoImplicitGEMM;GemmFwd1x1_0_1:0.844094,0,miopenConvolutionFwdAlgoGEMM;ConvDirectNaiveConvFwd:66.7204,0,miopenConvolutionFwdAlgoDirect
128-64-176-3x3-128-32-88-36-1x1-2x2-1x1-0-NCHW-FP16-F=ConvBinWinogradRxSf3x2:1.3557,0,miopenConvolutionFwdAlgoWinograd;ConvAsmImplicitGemmGTCDynamicFwdXdlopsNHWC:0.489805,181960704,miopenConvolutionFwdAlgoImplicitGEMM;GemmFwdRest:2.24459,6488064,miopenConvolutionFwdAlgoGEMM;ConvDirectNaiveConvFwd:46.5958,0,miopenConvolutionFwdAlgoDirect
128-32-88-1x1-512-32-88-36-0x0-1x1-1x1-0-NCHW-FP16-F=ConvBinWinogradRxSf3x2:1.48482,0,miopenConvolutionFwdAlgoWinograd;ConvAsmImplicitGemmGTCDynamicFwdXdlopsNHWC:0.363752,337379328,miopenConvolutionFwdAlgoImplicitGEMM;GemmFwd1x1_0_1:0.974635,0,miopenConvolutionFwdAlgoGEMM;ConvDirectNaiveConvFwd:30.2604,0,miopenConvolutionFwdAlgoDirect
256-64-176-1x1-512-32-88-36-0x0-2x2-1x1-0-NCHW-FP16-F=ConvBinWinogradRxSf3x2:5.22122,0,miopenConvolutionFwdAlgoWinograd;ConvAsmImplicitGemmGTCDynamicFwdXdlopsNHWC:0.984906,519045120,miopenConvolutionFwdAlgoImplicitGEMM;GemmFwd1x1_0_2:0.570171,155713536,miopenConvolutionFwdAlgoGEMM;ConvDirectNaiveConvFwd:62.4479,0,miopenConvolutionFwdAlgoDirect
512-32-88-1x1-128-32-88-36-0x0-1x1-1x1-0-NCHW-FP16-F=ConvBinWinogradRxSf3x2:1.28824,0,miopenConvolutionFwdAlgoWinograd;ConvAsmImplicitGemmGTCDynamicFwdXdlopsNHWC:0.386543,181665792,miopenConvolutionFwdAlgoImplicitGEMM;GemmFwd1x1_0_1:0.474798,0,miopenConvolutionFwdAlgoGEMM;ConvDirectNaiveConvFwd:31.9327,0,miopenConvolutionFwdAlgoDirect
128-32-88-3x3-128-32-88-36-1x1-1x1-1x1-0-NCHW-FP16-F=ConvBinWinogradRxSf2x3g1:0.751224,0,miopenConvolutionFwdAlgoWinograd;ConvBinWinogradRxSf3x2:1.30904,0,miopenConvolutionFwdAlgoWinograd;ConvAsmImplicitGemmGTCDynamicFwdXdlopsNHWC:0.341296,104103936,miopenConvolutionFwdAlgoImplicitGEMM;GemmFwdRest:2.14663,6488064,miopenConvolutionFwdAlgoGEMM;ConvDirectNaiveConvFwd:35.683,0,miopenConvolutionFwdAlgoDirect
512-32-88-1x1-256-32-88-36-0x0-1x1-1x1-0-NCHW-FP16-F=ConvBinWinogradRxSf3x2:2.56096,0,miopenConvolutionFwdAlgoWinograd;ConvAsmImplicitGemmGTCDynamicFwdXdlopsNHWC:0.56006,259522560,miopenConvolutionFwdAlgoImplicitGEMM;GemmFwd1x1_0_1:0.920212,0,miopenConvolutionFwdAlgoGEMM;ConvDirectNaiveConvFwd:61.7904,0,miopenConvolutionFwdAlgoDirect
256-32-88-3x3-256-16-44-36-1x1-2x2-1x1-0-NCHW-FP16-F=ConvBinWinogradRxSf3x2:1.55991,0,miopenConvolutionFwdAlgoWinograd;ConvAsmImplicitGemmGTCDynamicFwdXdlopsNHWC:0.406215,92012544,miopenConvolutionFwdAlgoImplicitGEMM;GemmFwdRest:3.20157,3244032,miopenConvolutionFwdAlgoGEMM;ConvDirectNaiveConvFwd:43.9123,0,miopenConvolutionFwdAlgoDirect
256-16-44-1x1-1024-16-44-36-0x0-1x1-1x1-0-NCHW-FP16-F=ConvBinWinogradRxSf3x2:1.46381,0,miopenConvolutionFwdAlgoWinograd;ConvAsmImplicitGemmGTCDynamicFwdXdlopsNHWC:0.238403,168689664,miopenConvolutionFwdAlgoImplicitGEMM;GemmFwd1x1_0_1:0.308881,0,miopenConvolutionFwdAlgoGEMM;ConvDirectNaiveConvFwd:30.4895,0,miopenConvolutionFwdAlgoDirect
512-32-88-1x1-1024-16-44-36-0x0-2x2-1x1-0-NCHW-FP16-F=ConvBinWinogradRxSf3x2:5.54563,0,miopenConvolutionFwdAlgoWinograd;ConvAsmImplicitGemmGTCDynamicFwdXdlopsNHWC:0.555555,259522560,miopenConvolutionFwdAlgoImplicitGEMM;GemmFwd1x1_0_2:0.363744,77856768,miopenConvolutionFwdAlgoGEMM;ConvDirectNaiveConvFwd:61.3779,0,miopenConvolutionFwdAlgoDirect
1024-16-44-1x1-256-16-44-36-0x0-1x1-1x1-0-NCHW-FP16-F=ConvBinWinogradRxSf3x2:1.44178,0,miopenConvolutionFwdAlgoWinograd;ConvAsmImplicitGemmGTCDynamicFwdXdlopsNHWC:0.244098,90832896,miopenConvolutionFwdAlgoImplicitGEMM;GemmFwd1x1_0_1:0.899436,0,miopenConvolutionFwdAlgoGEMM;ConvDirectNaiveConvFwd:31.6279,0,miopenConvolutionFwdAlgoDirect
256-16-44-3x3-256-16-44-36-1x1-1x1-1x1-0-NCHW-FP16-F=ConvBinWinogradRxSf2x3g1:0.709681,0,miopenConvolutionFwdAlgoWinograd;ConvBinWinogradRxSf3x2:1.51465,0,miopenConvolutionFwdAlgoWinograd;ConvAsmImplicitGemmGTCDynamicFwdXdlopsNHWC:0.336522,53084160,miopenConvolutionFwdAlgoImplicitGEMM;GemmFwdRest:3.18796,3244032,miopenConvolutionFwdAlgoGEMM;ConvDirectNaiveConvFwd:35.3193,0,miopenConvolutionFwdAlgoDirect
1024-16-44-1x1-512-16-44-36-0x0-1x1-1x1-0-NCHW-FP16-F=ConvBinWinogradRxSf3x2:2.74373,0,miopenConvolutionFwdAlgoWinograd;ConvAsmImplicitGemmGTCDynamicFwdXdlopsNHWC:0.350864,129761280,miopenConvolutionFwdAlgoImplicitGEMM;GemmFwd1x1_0_1:1.83588,0,miopenConvolutionFwdAlgoGEMM;ConvDirectNaiveConvFwd:61.6146,0,miopenConvolutionFwdAlgoDirect
512-16-44-3x3-512-8-22-36-1x1-2x2-1x1-0-NCHW-FP16-F=ConvBinWinogradRxSf3x2:1.72129,0,miopenConvolutionFwdAlgoWinograd;ConvAsmImplicitGemmGTCDynamicFwdXdlopsNHWC:0.366408,50135040,miopenConvolutionFwdAlgoImplicitGEMM;GemmFwdRest:2.46928,1622016,miopenConvolutionFwdAlgoGEMM;ConvDirectNaiveConvFwd:49.3764,0,miopenConvolutionFwdAlgoDirect
512-8-22-1x1-2048-8-22-36-0x0-1x1-1x1-0-NCHW-FP16-F=ConvBinWinogradRxSf3x2:1.48786,0,miopenConvolutionFwdAlgoWinograd;ConvAsmImplicitGemmGTCDynamicFwdXdlopsNHWC:0.196844,84344832,miopenConvolutionFwdAlgoImplicitGEMM;GemmFwd1x1_0_1:0.369792,0,miopenConvolutionFwdAlgoGEMM;ConvDirectNaiveConvFwd:39.5112,0,miopenConvolutionFwdAlgoDirect
1024-16-44-1x1-2048-8-22-36-0x0-2x2-1x1-0-NCHW-FP16-F=ConvBinWinogradRxSf3x2:5.86409,0,miopenConvolutionFwdAlgoWinograd;ConvAsmImplicitGemmGTCDynamicFwdXdlopsNHWC:0.364528,129761280,miopenConvolutionFwdAlgoImplicitGEMM;GemmFwd1x1_0_2:0.26389,38928384,miopenConvolutionFwdAlgoGEMM;ConvDirectNaiveConvFwd:79.3977,0,miopenConvolutionFwdAlgoDirect
2048-8-22-1x1-512-8-22-36-0x0-1x1-1x1-0-NCHW-FP16-F=ConvBinWinogradRxSf3x2:1.55119,0,miopenConvolutionFwdAlgoWinograd;ConvAsmImplicitGemmGTCDynamicFwdXdlopsNHWC:0.228459,45416448,miopenConvolutionFwdAlgoImplicitGEMM;GemmFwd1x1_0_1:0.424239,0,miopenConvolutionFwdAlgoGEMM;ConvDirectNaiveConvFwd:40.3857,0,miopenConvolutionFwdAlgoDirect
512-8-22-3x3-512-8-22-36-1x1-1x1-1x1-0-NCHW-FP16-F=ConvBinWinogradRxSf2x3g1:0.690201,0,miopenConvolutionFwdAlgoWinograd;ConvBinWinogradRxSf3x2:1.6879,0,miopenConvolutionFwdAlgoWinograd;ConvAsmImplicitGemmGTCDynamicFwdXdlopsNHWC:0.338433,30670848,miopenConvolutionFwdAlgoImplicitGEMM;GemmFwdRest:2.38288,1622016,miopenConvolutionFwdAlgoGEMM;ConvDirectNaiveConvFwd:43.7681,0,miopenConvolutionFwdAlgoDirect
256-64-176-1x1-256-64-176-36-0x0-1x1-1x1-0-NCHW-FP16-F=ConvBinWinogradRxSf3x2:5.21723,0,miopenConvolutionFwdAlgoWinograd;ConvAsmImplicitGemmGTCDynamicFwdXdlopsNHWC:1.48801,830472192,miopenConvolutionFwdAlgoImplicitGEMM;GemmFwd1x1_0_1:1.63451,0,miopenConvolutionFwdAlgoGEMM;ConvDirectNaiveConvFwd:128.963,0,miopenConvolutionFwdAlgoDirect
2048-8-22-1x1-256-8-22-36-0x0-1x1-1x1-0-NCHW-FP16-F=ConvBinWinogradRxSf3x2:0.782711,0,miopenConvolutionFwdAlgoWinograd;ConvAsmImplicitGemmGTCDynamicFwdXdlopsNHWC:0.157172,35684352,miopenConvolutionFwdAlgoImplicitGEMM;GemmFwd1x1_0_1:0.222699,0,miopenConvolutionFwdAlgoGEMM;ConvDirectNaiveConvFwd:20.3036,0,miopenConvolutionFwdAlgoDirect
256-64-176-3x3-256-64-176-36-1x1-1x1-1x1-0-NCHW-FP16-F=ConvBinWinogradRxSf2x3g1:11.0635,0,miopenConvolutionFwdAlgoWinograd;ConvBinWinogradRxSf3x2:19.6466,0,miopenConvolutionFwdAlgoWinograd;ConvAsmImplicitGemmGTCDynamicFwdXdlopsNHWC:4.63927,831651840,miopenConvolutionFwdAlgoImplicitGEMM;GemmFwdRest:12.3464,51904512,miopenConvolutionFwdAlgoGEMM;ConvDirectNaiveConvFwd:579.476,0,miopenConvolutionFwdAlgoDirect
256-32-88-3x3-256-32-88-36-1x1-1x1-1x1-0-NCHW-FP16-F=ConvBinWinogradRxSf2x3g1:2.80273,0,miopenConvolutionFwdAlgoWinograd;ConvBinWinogradRxSf3x2:5.14323,0,miopenConvolutionFwdAlgoWinograd;ConvAsmImplicitGemmGTCDynamicFwdXdlopsNHWC:1.11054,208797696,miopenConvolutionFwdAlgoImplicitGEMM;GemmFwdRest:5.12062,12976128,miopenConvolutionFwdAlgoGEMM;ConvDirectNaiveConvFwd:138.48,0,miopenConvolutionFwdAlgoDirect
256-8-22-3x3-256-8-22-36-1x1-1x1-1x1-0-NCHW-FP16-F=ConvBinWinogradRxSf2x3g1:0.187772,0,miopenConvolutionFwdAlgoWinograd;ConvBinWinogradRxSf3x2:0.439983,0,miopenConvolutionFwdAlgoWinograd;ConvAsmImplicitGemmGTCDynamicFwdXdlopsNHWC:0.123573,14155776,miopenConvolutionFwdAlgoImplicitGEMM;GemmFwdRest:1.28339,811008,miopenConvolutionFwdAlgoGEMM;ConvDirectNaiveConvFwd:11.0574,0,miopenConvolutionFwdAlgoDirect
256-64-176-1x1-1-64-176-36-0x0-1x1-1x1-0-NCHW-FP16-F=ConvBinWinogradRxSf3x2:0.701433,0,miopenConvolutionFwdAlgoWinograd;ConvHipImplicitGemmGroupFwdXdlops:0.801654,208429568,miopenConvolutionFwdAlgoImplicitGEMM;ConvAsmImplicitGemmGTCDynamicFwdXdlopsNHWC:0.861509,209240064,miopenConvolutionFwdAlgoImplicitGEMM;GemmFwd1x1_0_1:0.218515,0,miopenConvolutionFwdAlgoGEMM;ConvDirectNaiveConvFwd:6.46529,0,miopenConvolutionFwdAlgoDirect
256-32-88-1x1-1-32-88-36-0x0-1x1-1x1-0-NCHW-FP16-F=ConvBinWinogradRxSf3x2:0.194492,0,miopenConvolutionFwdAlgoWinograd;ConvAsmImplicitGemmGTCDynamicFwdXdlopsNHWC:0.177076,52310016,miopenConvolutionFwdAlgoImplicitGEMM;GemmFwd1x1_0_1:0.092974,0,miopenConvolutionFwdAlgoGEMM;ConvDirectNaiveConvFwd:1.61824,0,miopenConvolutionFwdAlgoDirect
256-16-44-1x1-1-16-44-36-0x0-1x1-1x1-0-NCHW-FP16-F=ConvBinWinogradRxSf3x2:0.0840862,0,miopenConvolutionFwdAlgoWinograd;ConvAsmImplicitGemmGTCDynamicFwdXdlopsNHWC:0.0581278,13077504,miopenConvolutionFwdAlgoImplicitGEMM;GemmFwd1x1_0_1:0.0209678,0,miopenConvolutionFwdAlgoGEMM;ConvDirectNaiveConvFwd:0.347536,0,miopenConvolutionFwdAlgoDirect
1-16-44-1x1-256-16-44-36-0x0-1x1-1x1-0-NCHW-FP16-B=ConvBinWinogradRxSf2x3g1:0.0564706,0,miopenConvolutionBwdDataAlgoWinograd;ConvBinWinogradRxSf3x2:0.0585588,0,miopenConvolutionBwdDataAlgoWinograd;ConvAsmImplicitGemmGTCDynamicBwdXdlopsNHWC:0.0644632,38928384,miopenConvolutionBwdDataAlgoImplicitGEMM;GemmBwd1x1_stride1:0.0313431,0,miopenConvolutionBwdDataAlgoGEMM;ConvDirectNaiveConvBwd:0.125125,0,miopenConvolutionBwdDataAlgoDirect
1-16-44-1x1-256-16-44-36-0x0-1x1-1x1-0-NCHW-FP16-W=ConvBinWinogradRxSf2x3:0.484398,0,miopenConvolutionBwdWeightsAlgoWinograd;ConvBinWinogradRxSf3x2:0.865461,0,miopenConvolutionBwdWeightsAlgoWinograd;ConvAsmImplicitGemmGTCDynamicWrwXdlopsNHWC:0.043479,12977152,miopenConvolutionBwdWeightsAlgoImplicitGEMM;ConvHipImplicitGemmGroupWrwXdlops:0.249083,38979584,miopenConvolutionBwdWeightsAlgoImplicitGEMM;GemmWrw1x1_stride1:0.384366,0,miopenConvolutionBwdWeightsAlgoGEMM;ConvDirectNaiveConvWrw:8.12665,0,miopenConvolutionBwdWeightsAlgoDirect
1-32-88-1x1-256-32-88-36-0x0-1x1-1x1-0-NCHW-FP16-B=ConvBinWinogradRxSf3x2:0.157916,0,miopenConvolutionBwdDataAlgoWinograd;ConvAsmImplicitGemmGTCDynamicBwdXdlopsNHWC:0.205212,155713536,miopenConvolutionBwdDataAlgoImplicitGEMM;GemmBwd1x1_stride1:0.202028,0,miopenConvolutionBwdDataAlgoGEMM;ConvDirectNaiveConvBwd:0.362048,0,miopenConvolutionBwdDataAlgoDirect
1-32-88-1x1-256-32-88-36-0x0-1x1-1x1-0-NCHW-FP16-W=ConvBinWinogradRxSf2x3:1.68059,0,miopenConvolutionBwdWeightsAlgoWinograd;ConvBinWinogradRxSf3x2:3.39835,0,miopenConvolutionBwdWeightsAlgoWinograd;ConvAsmImplicitGemmGTCDynamicWrwXdlopsNHWC:0.132125,51905536,miopenConvolutionBwdWeightsAlgoImplicitGEMM;ConvHipImplicitGemmGroupWrwXdlops:0.697016,155916800,miopenConvolutionBwdWeightsAlgoImplicitGEMM;GemmWrw1x1_stride1:0.672369,0,miopenConvolutionBwdWeightsAlgoGEMM;ConvDirectNaiveConvWrw:36.4549,0,miopenConvolutionBwdWeightsAlgoDirect
1-64-176-1x1-256-64-176-36-0x0-1x1-1x1-0-NCHW-FP16-B=ConvBinWinogradRxSf3x2:0.559444,0,miopenConvolutionBwdDataAlgoWinograd;ConvAsmImplicitGemmGTCDynamicBwdXdlopsNHWC:0.790055,622854144,miopenConvolutionBwdDataAlgoImplicitGEMM;GemmBwd1x1_stride1:0.588835,0,miopenConvolutionBwdDataAlgoGEMM;ConvDirectNaiveConvBwd:1.36142,0,miopenConvolutionBwdDataAlgoDirect
1-64-176-1x1-256-64-176-36-0x0-1x1-1x1-0-NCHW-FP16-W=ConvBinWinogradRxSf2x3:6.97661,0,miopenConvolutionBwdWeightsAlgoWinograd;ConvBinWinogradRxSf3x2:14.2658,0,miopenConvolutionBwdWeightsAlgoWinograd;ConvAsmImplicitGemmGTCDynamicWrwXdlopsNHWC:0.661513,207619072,miopenConvolutionBwdWeightsAlgoImplicitGEMM;ConvHipImplicitGemmGroupWrwXdlops:2.71316,623665664,miopenConvolutionBwdWeightsAlgoImplicitGEMM;GemmWrw1x1_stride1:0.576131,0,miopenConvolutionBwdWeightsAlgoGEMM;ConvDirectNaiveConvWrw:144.711,0,miopenConvolutionBwdWeightsAlgoDirect
256-8-22-3x3-256-8-22-36-1x1-1x1-1x1-0-NCHW-FP16-B=ConvBinWinogradRxSf2x3g1:0.188012,0,miopenConvolutionBwdDataAlgoWinograd;ConvBinWinogradRxSf3x2:0.407055,0,miopenConvolutionBwdDataAlgoWinograd;ConvAsmImplicitGemmGTCDynamicBwdXdlopsNHWC:0.118061,14155776,miopenConvolutionBwdDataAlgoImplicitGEMM;GemmBwdRest:1.01027,811008,miopenConvolutionBwdDataAlgoGEMM;ConvDirectNaiveConvBwd:29.5085,0,miopenConvolutionBwdDataAlgoDirect
256-8-22-3x3-256-8-22-36-1x1-1x1-1x1-0-NCHW-FP16-W=ConvBinWinogradRxSf3x2:0.247826,0,miopenConvolutionBwdWeightsAlgoWinograd;ConvHipImplicitGemmGroupWrwXdlops:0.308369,7667712,miopenConvolutionBwdWeightsAlgoImplicitGEMM;ConvAsmImplicitGemmGTCDynamicWrwXdlopsNHWC:0.098438,10027008,miopenConvolutionBwdWeightsAlgoImplicitGEMM;GemmWrwUniversal:1.06364,811008,miopenConvolutionBwdWeightsAlgoGEMM;ConvDirectNaiveConvWrw:15.8378,0,miopenConvolutionBwdWeightsAlgoDirect
256-16-44-3x3-256-16-44-36-1x1-1x1-1x1-0-NCHW-FP16-B=ConvBinWinogradRxSf2x3g1:0.710969,0,miopenConvolutionBwdDataAlgoWinograd;ConvBinWinogradRxSf3x2:1.45471,0,miopenConvolutionBwdDataAlgoWinograd;ConvAsmImplicitGemmGTCDynamicBwdXdlopsNHWC:0.312657,53084160,miopenConvolutionBwdDataAlgoImplicitGEMM;GemmBwdRest:1.99824,3244032,miopenConvolutionBwdDataAlgoGEMM;ConvDirectNaiveConvBwd:91.2798,0,miopenConvolutionBwdDataAlgoDirect
256-16-44-3x3-256-16-44-36-1x1-1x1-1x1-0-NCHW-FP16-W=ConvBinWinogradRxSf3x2:0.936179,0,miopenConvolutionBwdWeightsAlgoWinograd;ConvHipImplicitGemmGroupWrwXdlops:0.836238,27131904,miopenConvolutionBwdWeightsAlgoImplicitGEMM;ConvAsmImplicitGemmGTCDynamicWrwXdlopsNHWC:0.279162,29491200,miopenConvolutionBwdWeightsAlgoImplicitGEMM;GemmWrwUniversal:1.37627,3244032,miopenConvolutionBwdWeightsAlgoGEMM;ConvDirectNaiveConvWrw:85.4131,0,miopenConvolutionBwdWeightsAlgoDirect
256-32-88-3x3-256-32-88-36-1x1-1x1-1x1-0-NCHW-FP16-B=ConvBinWinogradRxSf2x3g1:2.79743,0,miopenConvolutionBwdDataAlgoWinograd;ConvBinWinogradRxSf3x2:4.99337,0,miopenConvolutionBwdDataAlgoWinograd;ConvAsmImplicitGemmGTCDynamicBwdXdlopsNHWC:1.04356,208797696,miopenConvolutionBwdDataAlgoImplicitGEMM;GemmBwdRest:3.36447,12976128,miopenConvolutionBwdDataAlgoGEMM;ConvDirectNaiveConvBwd:356.96,0,miopenConvolutionBwdDataAlgoDirect
256-32-88-3x3-256-32-88-36-1x1-1x1-1x1-0-NCHW-FP16-W=ConvBinWinogradRxSf3x2:4.13578,0,miopenConvolutionBwdWeightsAlgoWinograd;ConvHipImplicitGemmGroupWrwXdlops:2.85773,104988672,miopenConvolutionBwdWeightsAlgoImplicitGEMM;ConvAsmImplicitGemmGTCDynamicWrwXdlopsNHWC:0.981938,107347968,miopenConvolutionBwdWeightsAlgoImplicitGEMM;GemmWrwUniversal:3.47682,12976128,miopenConvolutionBwdWeightsAlgoGEMM;ConvDirectNaiveConvWrw:390.859,0,miopenConvolutionBwdWeightsAlgoDirect
256-64-176-3x3-256-64-176-36-1x1-1x1-1x1-0-NCHW-FP16-B=ConvBinWinogradRxSf2x3g1:11.0317,0,miopenConvolutionBwdDataAlgoWinograd;ConvBinWinogradRxSf3x2:19.2492,0,miopenConvolutionBwdDataAlgoWinograd;ConvAsmImplicitGemmGTCDynamicBwdXdlopsNHWC:4.37434,831651840,miopenConvolutionBwdDataAlgoImplicitGEMM;GemmBwdRest:11.0113,51904512,miopenConvolutionBwdDataAlgoGEMM;ConvDirectNaiveConvBwd:1423.21,0,miopenConvolutionBwdDataAlgoDirect
256-64-176-3x3-256-64-176-36-1x1-1x1-1x1-0-NCHW-FP16-W=ConvBinWinogradRxSf3x2:20.1236,0,miopenConvolutionBwdWeightsAlgoWinograd;ConvHipImplicitGemmGroupWrwXdlops:11.1832,416415744,miopenConvolutionBwdWeightsAlgoImplicitGEMM;ConvAsmImplicitGemmGTCDynamicWrwXdlopsNHWC:4.08644,418775040,miopenConvolutionBwdWeightsAlgoImplicitGEMM;GemmWrwUniversal:8.93988,51904512,miopenConvolutionBwdWeightsAlgoGEMM;ConvDirectNaiveConvWrw:1598.98,0,miopenConvolutionBwdWeightsAlgoDirect
256-8-22-1x1-2048-8-22-36-0x0-1x1-1x1-0-NCHW-FP16-B=ConvBinWinogradRxSf3x2:0.794894,0,miopenConvolutionBwdDataAlgoWinograd;ConvAsmImplicitGemmGTCDynamicBwdXdlopsNHWC:0.135629,81100800,miopenConvolutionBwdDataAlgoImplicitGEMM;GemmBwd1x1_stride1:0.222571,0,miopenConvolutionBwdDataAlgoGEMM;ConvDirectNaiveConvBwd:36.0418,0,miopenConvolutionBwdDataAlgoDirect
256-8-22-1x1-2048-8-22-36-0x0-1x1-1x1-0-NCHW-FP16-W=ConvBinWinogradRxSf2x3:0.891556,0,miopenConvolutionBwdWeightsAlgoWinograd;ConvBinWinogradRxSf3x2:1.65706,0,miopenConvolutionBwdWeightsAlgoWinograd;ConvAsmImplicitGemmGTCDynamicWrwXdlopsNHWC:0.12295,31293440,miopenConvolutionBwdWeightsAlgoImplicitGEMM;ConvHipImplicitGemmGroupWrwXdlops:0.280169,30244864,miopenConvolutionBwdWeightsAlgoImplicitGEMM;GemmWrw1x1_stride1:1.1549,0,miopenConvolutionBwdWeightsAlgoGEMM;ConvDirectNaiveConvWrw:39.3545,0,miopenConvolutionBwdWeightsAlgoDirect
256-16-44-1x1-1024-16-44-36-0x0-1x1-1x1-0-NCHW-FP16-B=ConvBinWinogradRxSf3x2:1.46566,0,miopenConvolutionBwdDataAlgoWinograd;ConvAsmImplicitGemmGTCDynamicBwdXdlopsNHWC:0.230132,168689664,miopenConvolutionBwdDataAlgoImplicitGEMM;GemmBwd1x1_stride1:0.391304,0,miopenConvolutionBwdDataAlgoGEMM;ConvDirectNaiveConvBwd:60.3316,0,miopenConvolutionBwdDataAlgoDirect
256-16-44-1x1-1024-16-44-36-0x0-1x1-1x1-0-NCHW-FP16-W=ConvBinWinogradRxSf2x3:2.07403,0,miopenConvolutionBwdWeightsAlgoWinograd;ConvBinWinogradRxSf3x2:3.56019,0,miopenConvolutionBwdWeightsAlgoWinograd;ConvAsmImplicitGemmGTCDynamicWrwXdlopsNHWC:0.198867,65929216,miopenConvolutionBwdWeightsAlgoImplicitGEMM;ConvHipImplicitGemmGroupWrwXdlops:0.417327,65404928,miopenConvolutionBwdWeightsAlgoImplicitGEMM;GemmWrw1x1_stride1:0.874924,0,miopenConvolutionBwdWeightsAlgoGEMM;ConvDirectNaiveConvWrw:78.597,0,miopenConvolutionBwdWeightsAlgoDirect
256-32-88-1x1-512-32-88-36-0x0-1x1-1x1-0-NCHW-FP16-B=ConvBinWinogradRxSf3x2:2.6678,0,miopenConvolutionBwdDataAlgoWinograd;ConvAsmImplicitGemmGTCDynamicBwdXdlopsNHWC:0.522861,363331584,miopenConvolutionBwdDataAlgoImplicitGEMM;GemmBwd1x1_stride1:0.678241,0,miopenConvolutionBwdDataAlgoGEMM;ConvDirectNaiveConvBwd:119.146,0,miopenConvolutionBwdDataAlgoDirect
256-32-88-1x1-512-32-88-36-0x0-1x1-1x1-0-NCHW-FP16-W=ConvBinWinogradRxSf2x3:5.03343,0,miopenConvolutionBwdWeightsAlgoWinograd;ConvBinWinogradRxSf3x2:10.0446,0,miopenConvolutionBwdWeightsAlgoWinograd;ConvAsmImplicitGemmGTCDynamicWrwXdlopsNHWC:0.530317,156237824,miopenConvolutionBwdWeightsAlgoImplicitGEMM;ConvHipImplicitGemmGroupWrwXdlops:0.873317,155975680,miopenConvolutionBwdWeightsAlgoImplicitGEMM;GemmWrw1x1_stride1:0.989546,0,miopenConvolutionBwdWeightsAlgoGEMM;ConvDirectNaiveConvWrw:300.753,0,miopenConvolutionBwdWeightsAlgoDirect
256-64-176-1x1-256-64-176-36-0x0-1x1-1x1-0-NCHW-FP16-B=ConvBinWinogradRxSf3x2:5.20331,0,miopenConvolutionBwdDataAlgoWinograd;ConvAsmImplicitGemmGTCDynamicBwdXdlopsNHWC:1.46656,830472192,miopenConvolutionBwdDataAlgoImplicitGEMM;GemmBwd1x1_stride1:0.665345,0,miopenConvolutionBwdDataAlgoGEMM;ConvDirectNaiveConvBwd:245.832,0,miopenConvolutionBwdDataAlgoDirect
256-64-176-1x1-256-64-176-36-0x0-1x1-1x1-0-NCHW-FP16-W=ConvBinWinogradRxSf2x3:10.4063,0,miopenConvolutionBwdWeightsAlgoWinograd;ConvBinWinogradRxSf3x2:21.0523,0,miopenConvolutionBwdWeightsAlgoWinograd;ConvAsmImplicitGemmGTCDynamicWrwXdlopsNHWC:1.38234,415498240,miopenConvolutionBwdWeightsAlgoImplicitGEMM;ConvHipImplicitGemmGroupWrwXdlops:2.00226,415367168,miopenConvolutionBwdWeightsAlgoImplicitGEMM;GemmWrw1x1_stride1:1.68027,0,miopenConvolutionBwdWeightsAlgoGEMM;ConvDirectNaiveConvWrw:596.41,0,miopenConvolutionBwdWeightsAlgoDirect
2048-8-22-1x1-512-8-22-36-0x0-1x1-1x1-0-NCHW-FP16-B=ConvBinWinogradRxSf3x2:1.54979,0,miopenConvolutionBwdDataAlgoWinograd;ConvAsmImplicitGemmGTCDynamicBwdXdlopsNHWC:0.218715,45416448,miopenConvolutionBwdDataAlgoImplicitGEMM;GemmBwd1x1_stride1:0.261234,0,miopenConvolutionBwdDataAlgoGEMM;ConvDirectNaiveConvBwd:76.1894,0,miopenConvolutionBwdDataAlgoDirect
2048-8-22-1x1-512-8-22-36-0x0-1x1-1x1-0-NCHW-FP16-W=ConvBinWinogradRxSf2x3:1.64818,0,miopenConvolutionBwdWeightsAlgoWinograd;ConvBinWinogradRxSf3x2:3.06905,0,miopenConvolutionBwdWeightsAlgoWinograd;ConvAsmImplicitGemmGTCDynamicWrwXdlopsNHWC:0.166893,36634624,miopenConvolutionBwdWeightsAlgoImplicitGEMM;ConvHipImplicitGemmGroupWrwXdlops:0.415279,34537472,miopenConvolutionBwdWeightsAlgoImplicitGEMM;GemmWrw1x1_stride1:0.842942,0,miopenConvolutionBwdWeightsAlgoGEMM;ConvDirectNaiveConvWrw:94.3371,0,miopenConvolutionBwdWeightsAlgoDirect
512-8-22-3x3-512-8-22-36-1x1-1x1-1x1-0-NCHW-FP16-B=ConvBinWinogradRxSf2x3g1:0.691849,0,miopenConvolutionBwdDataAlgoWinograd;ConvBinWinogradRxSf3x2:1.55821,0,miopenConvolutionBwdDataAlgoWinograd;ConvAsmImplicitGemmGTCDynamicBwdXdlopsNHWC:0.330089,30670848,miopenConvolutionBwdDataAlgoImplicitGEMM;GemmBwdRest:1.91764,1622016,miopenConvolutionBwdDataAlgoGEMM;ConvDirectNaiveConvBwd:114.997,0,miopenConvolutionBwdDataAlgoDirect
512-8-22-3x3-512-8-22-36-1x1-1x1-1x1-0-NCHW-FP16-W=ConvBinWinogradRxSf3x2:0.946035,0,miopenConvolutionBwdWeightsAlgoWinograd;ConvHipImplicitGemmGroupWrwXdlops:0.774047,17694720,miopenConvolutionBwdWeightsAlgoImplicitGEMM;ConvAsmImplicitGemmGTCDynamicWrwXdlopsNHWC:0.291785,27131904,miopenConvolutionBwdWeightsAlgoImplicitGEMM;GemmWrwUniversal:2.95299,1622016,miopenConvolutionBwdWeightsAlgoGEMM;ConvDirectNaiveConvWrw:49.7152,0,miopenConvolutionBwdWeightsAlgoDirect
512-8-22-1x1-2048-8-22-36-0x0-1x1-1x1-0-NCHW-FP16-B=ConvBinWinogradRxSf3x2:1.49012,0,miopenConvolutionBwdDataAlgoWinograd;ConvAsmImplicitGemmGTCDynamicBwdXdlopsNHWC:0.19006,84344832,miopenConvolutionBwdDataAlgoImplicitGEMM;GemmBwd1x1_stride1:0.353936,0,miopenConvolutionBwdDataAlgoGEMM;ConvDirectNaiveConvBwd:74.173,0,miopenConvolutionBwdDataAlgoDirect
512-8-22-1x1-2048-8-22-36-0x0-1x1-1x1-0-NCHW-FP16-W=ConvBinWinogradRxSf2x3:1.65015,0,miopenConvolutionBwdWeightsAlgoWinograd;ConvBinWinogradRxSf3x2:3.07437,0,miopenConvolutionBwdWeightsAlgoWinograd;ConvAsmImplicitGemmGTCDynamicWrwXdlopsNHWC:0.166692,36634624,miopenConvolutionBwdWeightsAlgoImplicitGEMM;ConvHipImplicitGemmGroupWrwXdlops:0.407887,34537472,miopenConvolutionBwdWeightsAlgoImplicitGEMM;GemmWrw1x1_stride1:1.12196,0,miopenConvolutionBwdWeightsAlgoGEMM;ConvDirectNaiveConvWrw:94.9024,0,miopenConvolutionBwdWeightsAlgoDirect
2048-8-22-1x1-1024-16-44-36-0x0-2x2-1x1-0-NCHW-FP16-B=ConvBinWinogradRxSf3x2:5.82978,0,miopenConvolutionBwdDataAlgoWinograd;ConvAsmImplicitGemmGTCDynamicBwdXdlopsNHWC:0.406719,181665792,miopenConvolutionBwdDataAlgoImplicitGEMM;GemmBwd1x1_stride2:0.3804,38928384,miopenConvolutionBwdDataAlgoGEMM;ConvDirectNaiveConvBwd:484.844,0,miopenConvolutionBwdDataAlgoDirect
2048-8-22-1x1-1024-16-44-36-0x0-2x2-1x1-0-NCHW-FP16-W=ConvHipImplicitGemmGroupWrwXdlops:0.79323,82051072,miopenConvolutionBwdWeightsAlgoImplicitGEMM;ConvAsmImplicitGemmGTCDynamicWrwXdlopsNHWC:0.341688,86245376,miopenConvolutionBwdWeightsAlgoImplicitGEMM;GemmWrwUniversal:2.27909,360448,miopenConvolutionBwdWeightsAlgoGEMM;ConvDirectNaiveConvWrw:200.225,0,miopenConvolutionBwdWeightsAlgoDirect
512-8-22-3x3-512-16-44-36-1x1-2x2-1x1-0-NCHW-FP16-B=ConvBinWinogradRxSf3x2:1.52887,0,miopenConvolutionBwdDataAlgoWinograd;ConvAsmImplicitGemmGTCDynamicBwdXdlopsNHWC:0.369392,89063424,miopenConvolutionBwdDataAlgoImplicitGEMM;GemmBwdRest:2.21244,1622016,miopenConvolutionBwdDataAlgoGEMM;ConvDirectNaiveConvBwd:356.939,0,miopenConvolutionBwdDataAlgoDirect
512-8-22-3x3-512-16-44-36-1x1-2x2-1x1-0-NCHW-FP16-W=ConvHipImplicitGemmGroupWrwXdlops:0.800966,37158912,miopenConvolutionBwdWeightsAlgoImplicitGEMM;ConvAsmImplicitGemmGTCDynamicWrwXdlopsNHWC:0.318905,46596096,miopenConvolutionBwdWeightsAlgoImplicitGEMM;GemmWrwUniversal:3.0667,1622016,miopenConvolutionBwdWeightsAlgoGEMM;ConvDirectNaiveConvWrw:74.3675,0,miopenConvolutionBwdWeightsAlgoDirect
512-16-44-1x1-1024-16-44-36-0x0-1x1-1x1-0-NCHW-FP16-B=ConvBinWinogradRxSf3x2:2.76247,0,miopenConvolutionBwdDataAlgoWinograd;ConvAsmImplicitGemmGTCDynamicBwdXdlopsNHWC:0.34204,181665792,miopenConvolutionBwdDataAlgoImplicitGEMM;GemmBwd1x1_stride1:0.598739,0,miopenConvolutionBwdDataAlgoGEMM;ConvDirectNaiveConvBwd:120.461,0,miopenConvolutionBwdDataAlgoDirect
512-16-44-1x1-1024-16-44-36-0x0-1x1-1x1-0-NCHW-FP16-W=ConvBinWinogradRxSf2x3:3.64233,0,miopenConvolutionBwdWeightsAlgoWinograd;ConvBinWinogradRxSf3x2:6.26737,0,miopenConvolutionBwdWeightsAlgoWinograd;ConvAsmImplicitGemmGTCDynamicWrwXdlopsNHWC:0.290986,79953920,miopenConvolutionBwdWeightsAlgoImplicitGEMM;ConvHipImplicitGemmGroupWrwXdlops:0.659674,78905344,miopenConvolutionBwdWeightsAlgoImplicitGEMM;GemmWrw1x1_stride1:0.512085,0,miopenConvolutionBwdWeightsAlgoGEMM;ConvDirectNaiveConvWrw:203.395,0,miopenConvolutionBwdWeightsAlgoDirect
1024-16-44-1x1-256-16-44-36-0x0-1x1-1x1-0-NCHW-FP16-B=ConvBinWinogradRxSf3x2:1.44503,0,miopenConvolutionBwdDataAlgoWinograd;ConvAsmImplicitGemmGTCDynamicBwdXdlopsNHWC:0.231426,90832896,miopenConvolutionBwdDataAlgoImplicitGEMM;GemmBwd1x1_stride1:0.316513,0,miopenConvolutionBwdDataAlgoGEMM;ConvDirectNaiveConvBwd:61.8853,0,miopenConvolutionBwdDataAlgoDirect
1024-16-44-1x1-256-16-44-36-0x0-1x1-1x1-0-NCHW-FP16-W=ConvBinWinogradRxSf2x3:2.06953,0,miopenConvolutionBwdWeightsAlgoWinograd;ConvBinWinogradRxSf3x2:3.55092,0,miopenConvolutionBwdWeightsAlgoWinograd;ConvAsmImplicitGemmGTCDynamicWrwXdlopsNHWC:0.19934,65929216,miopenConvolutionBwdWeightsAlgoImplicitGEMM;ConvHipImplicitGemmGroupWrwXdlops:0.419294,65404928,miopenConvolutionBwdWeightsAlgoImplicitGEMM;GemmWrw1x1_stride1:0.891756,0,miopenConvolutionBwdWeightsAlgoGEMM;ConvDirectNaiveConvWrw:99.3561,0,miopenConvolutionBwdWeightsAlgoDirect
1024-16-44-1x1-512-32-88-36-0x0-2x2-1x1-0-NCHW-FP16-B=ConvBinWinogradRxSf3x2:5.61277,0,miopenConvolutionBwdDataAlgoWinograd;ConvAsmImplicitGemmGTCDynamicBwdXdlopsNHWC:0.555843,363331584,miopenConvolutionBwdDataAlgoImplicitGEMM;GemmBwd1x1_stride2:0.37332,77856768,miopenConvolutionBwdDataAlgoGEMM;ConvDirectNaiveConvBwd:463.587,0,miopenConvolutionBwdDataAlgoDirect
1024-16-44-1x1-512-32-88-36-0x0-2x2-1x1-0-NCHW-FP16-W=ConvHipImplicitGemmGroupWrwXdlops:1.02601,156762112,miopenConvolutionBwdWeightsAlgoImplicitGEMM;ConvAsmImplicitGemmGTCDynamicWrwXdlopsNHWC:0.543844,157810688,miopenConvolutionBwdWeightsAlgoImplicitGEMM;GemmWrwUniversal:2.57482,720896,miopenConvolutionBwdWeightsAlgoGEMM;ConvDirectNaiveConvWrw:284.712,0,miopenConvolutionBwdWeightsAlgoDirect
256-16-44-3x3-256-32-88-36-1x1-2x2-1x1-0-NCHW-FP16-B=ConvBinWinogradRxSf3x2:1.57334,0,miopenConvolutionBwdDataAlgoWinograd;ConvAsmImplicitGemmGTCDynamicBwdXdlopsNHWC:0.384871,169869312,miopenConvolutionBwdDataAlgoImplicitGEMM;GemmBwdRest:2.62714,3244032,miopenConvolutionBwdDataAlgoGEMM;ConvDirectNaiveConvBwd:340.276,0,miopenConvolutionBwdDataAlgoDirect
256-16-44-3x3-256-32-88-36-1x1-2x2-1x1-0-NCHW-FP16-W=ConvHipImplicitGemmGroupWrwXdlops:0.90326,66060288,miopenConvolutionBwdWeightsAlgoImplicitGEMM;ConvAsmImplicitGemmGTCDynamicWrwXdlopsNHWC:0.344504,68419584,miopenConvolutionBwdWeightsAlgoImplicitGEMM;GemmWrwUniversal:1.51119,3244032,miopenConvolutionBwdWeightsAlgoGEMM;ConvDirectNaiveConvWrw:97.9217,0,miopenConvolutionBwdWeightsAlgoDirect
512-32-88-1x1-128-32-88-36-0x0-1x1-1x1-0-NCHW-FP16-B=ConvBinWinogradRxSf3x2:1.29016,0,miopenConvolutionBwdDataAlgoWinograd;ConvAsmImplicitGemmGTCDynamicBwdXdlopsNHWC:0.359936,181665792,miopenConvolutionBwdDataAlgoImplicitGEMM;GemmBwd1x1_stride1:0.28673,0,miopenConvolutionBwdDataAlgoGEMM;ConvDirectNaiveConvBwd:62.127,0,miopenConvolutionBwdDataAlgoDirect
512-32-88-1x1-128-32-88-36-0x0-1x1-1x1-0-NCHW-FP16-W=ConvBinWinogradRxSf2x3:2.28088,0,miopenConvolutionBwdWeightsAlgoWinograd;ConvBinWinogradRxSf3x2:4.29524,0,miopenConvolutionBwdWeightsAlgoWinograd;ConvAsmImplicitGemmGTCDynamicWrwXdlopsNHWC:0.314633,130023424,miopenConvolutionBwdWeightsAlgoImplicitGEMM;ConvHipImplicitGemmGroupWrwXdlops:0.533316,129892352,miopenConvolutionBwdWeightsAlgoImplicitGEMM;GemmWrw1x1_stride1:0.978386,0,miopenConvolutionBwdWeightsAlgoGEMM;ConvDirectNaiveConvWrw:131.99,0,miopenConvolutionBwdWeightsAlgoDirect
128-32-88-3x3-128-32-88-36-1x1-1x1-1x1-0-NCHW-FP16-B=ConvBinWinogradRxSf2x3g1:0.752447,0,miopenConvolutionBwdDataAlgoWinograd;ConvBinWinogradRxSf3x2:1.30759,0,miopenConvolutionBwdDataAlgoWinograd;ConvAsmImplicitGemmGTCDynamicBwdXdlopsNHWC:0.348504,104103936,miopenConvolutionBwdDataAlgoImplicitGEMM;GemmBwdRest:1.94264,6488064,miopenConvolutionBwdDataAlgoGEMM;ConvDirectNaiveConvBwd:90.9523,0,miopenConvolutionBwdDataAlgoDirect
128-32-88-3x3-128-32-88-36-1x1-1x1-1x1-0-NCHW-FP16-W=ConvBinWinogradRxSf2x3:1.73013,0,miopenConvolutionBwdWeightsAlgoWinograd;ConvBinWinogradRxSf3x2:3.5755,0,miopenConvolutionBwdWeightsAlgoWinograd;ConvHipImplicitGemmGroupWrwXdlops:0.999194,52199424,miopenConvolutionBwdWeightsAlgoImplicitGEMM;ConvAsmImplicitGemmGTCDynamicWrwXdlopsNHWC:0.322536,52789248,miopenConvolutionBwdWeightsAlgoImplicitGEMM;GemmWrwUniversal:2.02993,6488064,miopenConvolutionBwdWeightsAlgoGEMM;ConvDirectNaiveConvWrw:121.193,0,miopenConvolutionBwdWeightsAlgoDirect
128-32-88-1x1-512-32-88-36-0x0-1x1-1x1-0-NCHW-FP16-B=ConvBinWinogradRxSf3x2:1.48702,0,miopenConvolutionBwdDataAlgoWinograd;ConvAsmImplicitGemmGTCDynamicBwdXdlopsNHWC:0.355624,337379328,miopenConvolutionBwdDataAlgoImplicitGEMM;GemmBwd1x1_stride1:0.333729,0,miopenConvolutionBwdDataAlgoGEMM;ConvDirectNaiveConvBwd:59.7375,0,miopenConvolutionBwdDataAlgoDirect
128-32-88-1x1-512-32-88-36-0x0-1x1-1x1-0-NCHW-FP16-W=ConvBinWinogradRxSf2x3:2.52557,0,miopenConvolutionBwdWeightsAlgoWinograd;ConvBinWinogradRxSf3x2:4.93042,0,miopenConvolutionBwdWeightsAlgoWinograd;ConvAsmImplicitGemmGTCDynamicWrwXdlopsNHWC:0.317193,130023424,miopenConvolutionBwdWeightsAlgoImplicitGEMM;ConvHipImplicitGemmGroupWrwXdlops:0.526501,129892352,miopenConvolutionBwdWeightsAlgoImplicitGEMM;ConvBinWinogradRxSf2x3g1:2.52454,0,miopenConvolutionBwdWeightsAlgoWinograd;GemmWrw1x1_stride1:0.981298,0,miopenConvolutionBwdWeightsAlgoGEMM;ConvDirectNaiveConvWrw:150.44,0,miopenConvolutionBwdWeightsAlgoDirect
512-32-88-1x1-256-64-176-36-0x0-2x2-1x1-0-NCHW-FP16-B=ConvBinWinogradRxSf3x2:5.49397,0,miopenConvolutionBwdDataAlgoWinograd;ConvAsmImplicitGemmGTCDynamicBwdXdlopsNHWC:1.00181,726663168,miopenConvolutionBwdDataAlgoImplicitGEMM;GemmBwd1x1_stride2:0.642522,155713536,miopenConvolutionBwdDataAlgoGEMM;ConvDirectNaiveConvBwd:460.283,0,miopenConvolutionBwdDataAlgoDirect
512-32-88-1x1-256-64-176-36-0x0-2x2-1x1-0-NCHW-FP16-W=ConvHipImplicitGemmGroupWrwXdlops:1.55582,311689216,miopenConvolutionBwdWeightsAlgoImplicitGEMM;ConvAsmImplicitGemmGTCDynamicWrwXdlopsNHWC:0.964426,311951360,miopenConvolutionBwdWeightsAlgoImplicitGEMM;GemmWrwUniversal:2.60537,1441792,miopenConvolutionBwdWeightsAlgoGEMM;ConvDirectNaiveConvWrw:296.419,0,miopenConvolutionBwdWeightsAlgoDirect
128-32-88-3x3-128-64-176-36-1x1-2x2-1x1-0-NCHW-FP16-B=ConvBinWinogradRxSf3x2:1.63868,0,miopenConvolutionBwdDataAlgoWinograd;ConvAsmImplicitGemmGTCDynamicBwdXdlopsNHWC:0.510885,337674240,miopenConvolutionBwdDataAlgoImplicitGEMM;GemmBwdRest:3.04478,6488064,miopenConvolutionBwdDataAlgoGEMM;ConvDirectNaiveConvBwd:330.379,0,miopenConvolutionBwdDataAlgoDirect
128-32-88-3x3-128-64-176-36-1x1-2x2-1x1-0-NCHW-FP16-W=ConvHipImplicitGemmGroupWrwXdlops:1.13569,130056192,miopenConvolutionBwdWeightsAlgoImplicitGEMM;ConvAsmImplicitGemmGTCDynamicWrwXdlopsNHWC:0.453206,130646016,miopenConvolutionBwdWeightsAlgoImplicitGEMM;GemmWrwUniversal:2.12694,6488064,miopenConvolutionBwdWeightsAlgoGEMM;ConvDirectNaiveConvWrw:124.076,0,miopenConvolutionBwdWeightsAlgoDirect
128-64-176-1x1-256-64-176-36-0x0-1x1-1x1-0-NCHW-FP16-B=ConvBinWinogradRxSf3x2:2.89786,0,miopenConvolutionBwdDataAlgoWinograd;ConvAsmImplicitGemmGTCDynamicBwdXdlopsNHWC:0.953308,726663168,miopenConvolutionBwdDataAlgoImplicitGEMM;GemmBwd1x1_stride1:0.596987,0,miopenConvolutionBwdDataAlgoGEMM;ConvDirectNaiveConvBwd:121.626,0,miopenConvolutionBwdDataAlgoDirect
128-64-176-1x1-256-64-176-36-0x0-1x1-1x1-0-NCHW-FP16-W=ConvBinWinogradRxSf2x3:9.98332,0,miopenConvolutionBwdWeightsAlgoWinograd;ConvBinWinogradRxSf3x2:20.0116,0,miopenConvolutionBwdWeightsAlgoWinograd;ConvAsmImplicitGemmGTCDynamicWrwXdlopsNHWC:0.925492,311558144,miopenConvolutionBwdWeightsAlgoImplicitGEMM;ConvHipImplicitGemmGroupWrwXdlops:1.28692,311492608,miopenConvolutionBwdWeightsAlgoImplicitGEMM;GemmWrw1x1_stride1:1.14575,0,miopenConvolutionBwdWeightsAlgoGEMM;ConvDirectNaiveConvWrw:301.485,0,miopenConvolutionBwdWeightsAlgoDirect
256-64-176-1x1-64-64-176-36-0x0-1x1-1x1-0-NCHW-FP16-B=ConvBinWinogradRxSf3x2:1.32891,0,miopenConvolutionBwdDataAlgoWinograd;ConvAsmImplicitGemmGTCDynamicBwdXdlopsNHWC:0.839365,363331584,miopenConvolutionBwdDataAlgoImplicitGEMM;GemmBwd1x1_stride1:0.519181,0,miopenConvolutionBwdDataAlgoGEMM;ConvDirectNaiveConvBwd:65.3456,0,miopenConvolutionBwdDataAlgoDirect
256-64-176-1x1-64-64-176-36-0x0-1x1-1x1-0-NCHW-FP16-W=ConvBinWinogradRxSf2x3:8.77037,0,miopenConvolutionBwdWeightsAlgoWinograd;ConvBinWinogradRxSf3x2:17.6058,0,miopenConvolutionBwdWeightsAlgoWinograd;ConvAsmImplicitGemmGTCDynamicWrwXdlopsNHWC:0.773423,259588096,miopenConvolutionBwdWeightsAlgoImplicitGEMM;ConvHipImplicitGemmGroupWrwXdlops:0.984386,259555328,miopenConvolutionBwdWeightsAlgoImplicitGEMM;GemmWrw1x1_stride1:1.66539,0,miopenConvolutionBwdWeightsAlgoGEMM;ConvDirectNaiveConvWrw:152.07,0,miopenConvolutionBwdWeightsAlgoDirect
64-64-176-3x3-64-64-176-36-1x1-1x1-1x1-0-NCHW-FP16-B=ConvBinWinogradRxSf2x3g1:0.845373,0,miopenConvolutionBwdDataAlgoWinograd;ConvBinWinogradRxSf3x2:1.36053,0,miopenConvolutionBwdDataAlgoWinograd;ConvAsmImplicitGemmGTCDynamicBwdXdlopsNHWC:0.533917,207691776,miopenConvolutionBwdDataAlgoImplicitGEMM;GemmBwdRest:3.27657,12976128,miopenConvolutionBwdDataAlgoGEMM;ConvDirectNaiveConvBwd:94.1029,0,miopenConvolutionBwdDataAlgoDirect
64-64-176-3x3-64-64-176-36-1x1-1x1-1x1-0-NCHW-FP16-W=ConvBinWinogradRxSf2x3:6.74296,0,miopenConvolutionBwdWeightsAlgoWinograd;ConvBinWinogradRxSf3x2:14.3771,0,miopenConvolutionBwdWeightsAlgoWinograd;ConvHipImplicitGemmGroupWrwXdlops:1.23566,103882752,miopenConvolutionBwdWeightsAlgoImplicitGEMM;ConvAsmImplicitGemmGTCDynamicWrwXdlopsNHWC:0.483973,104030208,miopenConvolutionBwdWeightsAlgoImplicitGEMM;GemmWrwUniversal:2.19606,12976128,miopenConvolutionBwdWeightsAlgoGEMM;ConvDirectNaiveConvWrw:282.53,0,miopenConvolutionBwdWeightsAlgoDirect
64-64-176-1x1-256-64-176-36-0x0-1x1-1x1-0-NCHW-FP16-B=ConvBinWinogradRxSf3x2:1.73806,0,miopenConvolutionBwdDataAlgoWinograd;ConvAsmImplicitGemmGTCDynamicBwdXdlopsNHWC:0.737536,674758656,miopenConvolutionBwdDataAlgoImplicitGEMM;GemmBwd1x1_stride1:0.469262,0,miopenConvolutionBwdDataAlgoGEMM;ConvDirectNaiveConvBwd:60.8356,0,miopenConvolutionBwdDataAlgoDirect
64-64-176-1x1-256-64-176-36-0x0-1x1-1x1-0-NCHW-FP16-W=ConvBinWinogradRxSf2x3:9.43019,0,miopenConvolutionBwdWeightsAlgoWinograd;ConvBinWinogradRxSf3x2:18.8115,0,miopenConvolutionBwdWeightsAlgoWinograd;ConvAsmImplicitGemmGTCDynamicWrwXdlopsNHWC:0.763863,259588096,miopenConvolutionBwdWeightsAlgoImplicitGEMM;ConvHipImplicitGemmGroupWrwXdlops:1.00022,259555328,miopenConvolutionBwdWeightsAlgoImplicitGEMM;GemmWrw1x1_stride1:0.809142,0,miopenConvolutionBwdWeightsAlgoGEMM;ConvDirectNaiveConvWrw:150.345,0,miopenConvolutionBwdWeightsAlgoDirect
64-64-176-1x1-64-64-176-36-0x0-1x1-1x1-0-NCHW-FP16-B=ConvBinWinogradRxSf3x2:0.454086,0,miopenConvolutionBwdDataAlgoWinograd;ConvAsmImplicitGemmGTCDynamicBwdXdlopsNHWC:0.230333,207618048,miopenConvolutionBwdDataAlgoImplicitGEMM;GemmBwd1x1_stride1:0.3526,0,miopenConvolutionBwdDataAlgoGEMM;ConvDirectNaiveConvBwd:16.3574,0,miopenConvolutionBwdDataAlgoDirect
64-64-176-1x1-64-64-176-36-0x0-1x1-1x1-0-NCHW-FP16-W=ConvBinWinogradRxSf2x3:7.66911,0,miopenConvolutionBwdWeightsAlgoWinograd;ConvBinWinogradRxSf3x2:14.5794,0,miopenConvolutionBwdWeightsAlgoWinograd;ConvAsmImplicitGemmGTCDynamicWrwXdlopsNHWC:0.210299,103825408,miopenConvolutionBwdWeightsAlgoImplicitGEMM;ConvHipImplicitGemmGroupWrwXdlops:0.368592,103817216,miopenConvolutionBwdWeightsAlgoImplicitGEMM;GemmWrw1x1_stride1:0.79959,0,miopenConvolutionBwdWeightsAlgoGEMM;ConvDirectNaiveConvWrw:142.259,0,miopenConvolutionBwdWeightsAlgoDirect
64-128-352-7x7-3-256-704-36-3x3-2x2-1x1-0-NCHW-FP16-W=ConvHipImplicitGemmGroupWrwXdlops:28.3337,324422144,miopenConvolutionBwdWeightsAlgoImplicitGEMM;ConvAsmImplicitGemmGTCDynamicWrwXdlopsNHWC:1.42362,246603008,miopenConvolutionBwdWeightsAlgoImplicitGEMM;GemmWrwUniversal:25.1756,13246464,miopenConvolutionBwdWeightsAlgoGEMM;ConvDirectNaiveConvWrw:374.853,0,miopenConvolutionBwdWeightsAlgoDirect
